id,name,description,category,url,frameworks,languages,features,integrations,maturityScore,popularityScore,pricing,notes
"7cedf2e2-2831-46b6-95d0-8b7742d5547b","Plasmic","Visual builder for React applications with code export.","Frontend/Design","https://www.plasmic.app","React;Next.js;Gatsby","JavaScript;TypeScript","Visual editing;code sync;CMS;component marketplace","React;Next.js;Gatsby;Figma","8.5","8","Free tier, Team $28/user/month","Bridge between design and code, developer-friendly"
"33cfd89d-1142-4e25-ac6f-094a2c4802aa","Builder.io","Visual development platform for creating digital experiences.","Frontend/Design","https://www.builder.io","React;Vue;Angular;Next.js","JavaScript;TypeScript","Visual CMS;A/B testing;personalization;headless architecture","Shopify;React;Vue;Angular","9","8.5","Free tier, Growth $99/month","Enterprise-grade, excellent for marketing teams"
"200d4e31-3404-46f8-a81a-69f273593f02","Retool","Low-code platform for building internal tools quickly.","Frontend/Design","https://retool.com","JavaScript;SQL","JavaScript;SQL;Python","Drag-drop UI;database connectors;API integrations;custom code","PostgreSQL;MySQL;MongoDB;REST APIs","9","9","Free tier, Team $10/user/month","Industry standard for internal tools"
"4e7c763e-225e-4564-b010-a04efcb29d22","Appsmith","Open-source low-code platform for building internal apps.","Frontend/Design","https://www.appsmith.com","JavaScript","JavaScript;SQL","Visual builder;database integration;REST/GraphQL;Git sync","PostgreSQL;MongoDB;REST APIs;GraphQL","8","8.2","Free self-hosted, Cloud from $0","Open-source Retool alternative"
"9aff7c1c-83a2-4c37-9e93-e1b1333fea67","Directus","Open-source data platform for headless CMS and API.","Backend/Database","https://directus.io","Node.js;Vue.js","JavaScript;TypeScript","Headless CMS;REST/GraphQL API;data studio;workflows","PostgreSQL;MySQL;SQLite;MongoDB","8.5","8","Free self-hosted, Cloud from $15/month","Database-first approach, very flexible"
"add8d7c5-6a0b-4f73-b5f0-44afa1e5c254","Strapi","Open-source headless CMS for building APIs quickly.","Backend/Database","https://strapi.io","Node.js;React","JavaScript;TypeScript","Content types builder;REST/GraphQL;media library;i18n","PostgreSQL;MySQL;SQLite;MongoDB","9","9.2","Free self-hosted, Cloud from $99/month","Most popular open-source headless CMS"
"5e916703-d6ae-4349-91f9-f821da15bd68","Hygraph","GraphQL-native headless CMS with content federation.","Backend/Database","https://hygraph.com","GraphQL","All via GraphQL","GraphQL API;content federation;webhooks;localization","Next.js;Gatsby;Remix;Vercel","8.5","7.8","Free tier, Pro from $299/month","Formerly GraphCMS, excellent for GraphQL projects"
"9aa736da-1dd3-4467-ad8c-f19b11847e7e","Convex","Backend platform with real-time sync and serverless functions.","Backend/Database","https://www.convex.dev","React;Next.js;Vue","TypeScript;JavaScript","Real-time sync;serverless functions;ACID transactions;type safety","React;Next.js;Clerk;Auth0","7.5","7","Free tier, Pro $25/month","Modern Firebase alternative with better DX"
